{
  "body_sha256": "fa73e18bac107951a63374a7d16a0edae0e0382545cffafc2433b4f3d7d52286",
  "command": "literature/verify_quotes.py --stamp",
  "doi": "10.1126/science.abj8754",
  "extract_sha256": "12fc147edc144ff8c64f71cabb50d789d984123d4b96a80e4c5825f270dc35a3",
  "extract_tool": "extract_text.py",
  "extract_tool_version": "pypdf=6.13.2;beautifulsoup4=4.15.0;lxml=6.1.1",
  "file": "literature/baek_2021.pdf",
  "host_user": "56687218+Vasquomw21@users.noreply.github.com",
  "key": "baek_2021",
  "pmcid": "",
  "record_sha256": "7ed7eda11e6f74bf701cc85cc4597edc72c85c3127c8e5090672a393b8399792",
  "retrieved": "20260603",
  "source_sha256": "2163437874980b897c2ae213a2e27fa783de84edb9fdba4f04c8c188ca16278d",
  "transcript_sha256": "dcc69a44f8923be038b7c31aaee69494c9919595ce8c2330481fcc4fedd660d1",
  "url": "https://doi.org/10.1126/science.abj8754",
  "verified_date": "20260717",
  "verified_verdict": "pass",
  "verifier_version": "2"
}
