{
  "body_sha256": "32809bfa887ad4379aad10a25a1f751d39b0e13a870d8b6b3cdd29c0ff724d92",
  "command": "literature/verify_quotes.py --stamp",
  "doi": "10.6028/NIST.FIPS.203",
  "extract_sha256": "dbaaf95d72443597485d4d3c27a505ce4a98df90d81728fdad3080e63c619533",
  "extract_tool": "extract_text.py",
  "extract_tool_version": "pypdf=6.13.2;beautifulsoup4=4.15.0;lxml=6.1.1",
  "file": "literature/nist_2024.pdf",
  "host_user": "56687218+Vasquomw21@users.noreply.github.com",
  "key": "nist_2024",
  "pmcid": "",
  "record_sha256": "0c6aa87f11435754294060e8eaa1c4d6583723190964fd82caba4ade62f7d660",
  "retrieved": "20260603",
  "source_sha256": "fe1f12f32a7e44ec9fdebbf400cda843a40b506dee676725234dc6f7923b6cac",
  "transcript_sha256": "fb547b60dd7816081fdbe2376c4fd47047a33b0f46fa5f1e32ff5a3ec834c82d",
  "url": "https://doi.org/10.6028/NIST.FIPS.203",
  "verified_date": "20260717",
  "verified_verdict": "pass",
  "verifier_version": "2"
}
