{
  "body_sha256": "ac6ee26c6119efd011cddfd7cfb6002cd5879863742ca5c4d585be9505543b2d",
  "command": "literature/verify_quotes.py --stamp",
  "doi": "10.1073/pnas.1619152114",
  "extract_sha256": "1f88ed2d6d1b5eb97849b7e886e66bbea0f91c5ddfe8c8408230bec5244def85",
  "extract_tool": "extract_text.py",
  "extract_tool_version": "pypdf=6.9.2;beautifulsoup4=4.14.3;lxml=6.0.2",
  "file": "literature/reiher_2017.pdf",
  "host_user": "56687218+Vasquomw21@users.noreply.github.com",
  "key": "reiher_2017",
  "pmcid": "",
  "record_sha256": "e1f797ad56346b314d05c8ccc2a4cc69bffe2c430d3fa4367e71f4efdbb66a35",
  "retrieved": "20260603",
  "source_sha256": "34343e00ffd4ea98f9b120e99b71586785d8ae4af984f3630b1133681508e1d8",
  "transcript_sha256": "1ca40539f3d142ad2be13a62e632615d2e91ae3405c25bfc5ef0d0266676e5e6",
  "url": "https://doi.org/10.1073/pnas.1619152114",
  "verified_date": "20260615",
  "verified_verdict": "pass",
  "verifier_version": "2"
}
