{
  "body_sha256": "8475bc6698a8c85ec3dcdef2f4c9f522f7a3db737445727c9bef78e9c7e81e90",
  "command": "literature/verify_quotes.py --stamp",
  "doi": "10.1161/JAHA.119.015553",
  "extract_sha256": "3e82bc89baea192b71b5151637fa1c7d806aad10a92e8d8bd0d7444f17b967cf",
  "extract_tool": "extract_text.py",
  "extract_tool_version": "pypdf=6.13.2;beautifulsoup4=4.15.0;lxml=6.1.1",
  "file": "literature/sun_2021.html",
  "host_user": "56687218+Vasquomw21@users.noreply.github.com",
  "key": "sun_2021",
  "pmcid": "PMC8174240",
  "record_sha256": "7d8eaecbf6d312de11722275b461cb096baa01eb69328159c02c0f96664cffc8",
  "retrieved": "20260614",
  "source_sha256": "921dbe54c864f62f78ec9722d20c686737bb60a8a399e606d8cc2b62c041a263",
  "transcript_sha256": "0a947379e8aacc8f715d4bf12f8c7115715b02128c8b4bafa8b273f8598ee441",
  "url": "https://pmc.ncbi.nlm.nih.gov/articles/PMC8174240/",
  "verified_date": "20260717",
  "verified_verdict": "pass",
  "verifier_version": "2"
}
