{
  "body_sha256": "86c000be0b1e78e6ce0c2d081669a090cea8117f8c7dcf92bf4606c9f8e7bf4e",
  "command": "literature/verify_quotes.py --stamp",
  "doi": "10.1038/s41586-022-04532-4",
  "extract_sha256": "11094db3937d81c37f9644b751d65b520a2ac3d4de038518c07472bad1b56c25",
  "extract_tool": "extract_text.py",
  "extract_tool_version": "pypdf=6.13.2;beautifulsoup4=4.15.0;lxml=6.1.1",
  "file": "literature/temmam_2022.html",
  "host_user": "56687218+Vasquomw21@users.noreply.github.com",
  "key": "temmam_2022",
  "pmcid": "",
  "record_sha256": "d05e09595d360f05041fd1f605715306e1b07448233889ed3af9d477c7007dae",
  "retrieved": "20260614",
  "source_sha256": "56cc6616fa3478be4eb1c9fecd9169222d8c385728f2a07b506bb91c4c3a47fe",
  "transcript_sha256": "05359cb1a7a8707aa01d13bc21a1ef91a4134625a3b64da278e9de1da8c6507c",
  "url": "https://www.nature.com/articles/s41586-022-04532-4",
  "verified_date": "20260614",
  "verified_verdict": "pass",
  "verifier_version": "2"
}
