{
  "body_sha256": "3ed6a633fe9785751dc7acad16e02b5892fcaff254c5e5f1af97ac8c7f3990c6",
  "command": "literature/verify_quotes.py --stamp",
  "doi": "10.1002/bies.202000240",
  "extract_sha256": "41ecce69e239abf076f9e7cd5fe32e7ac1169c90a8621ec54ee7593059b0759f",
  "extract_tool": "extract_text.py",
  "extract_tool_version": "pypdf=6.13.2;beautifulsoup4=4.15.0;lxml=6.1.1",
  "file": "literature/segreto_2021.html",
  "host_user": "56687218+Vasquomw21@users.noreply.github.com",
  "key": "segreto_2021",
  "pmcid": "PMC7744920",
  "record_sha256": "042d4eb1710acbb203f6145e7bf19917dc72e0c0f9adafec06370ee0c98c11a0",
  "retrieved": "20260613",
  "source_sha256": "9652d815423ce5ffce6579914d406ae3f46346858eca13ac99e6470c26871a11",
  "transcript_sha256": "597cca1434d661fdf9261945c9c2b852d5d009f535892eafe0a1eb1e977e3ecc",
  "url": "https://pmc.ncbi.nlm.nih.gov/articles/PMC7744920/",
  "verified_date": "20260614",
  "verified_verdict": "pass",
  "verifier_version": "2"
}
