{
  "body_sha256": "8f1cb2a639b01f07c424eac601636daf4b93e7f6ff8a6b89abcfa9cbfd371a7d",
  "command": "literature/verify_quotes.py --stamp",
  "doi": "10.1016/j.physletb.2008.11.057",
  "extract_sha256": "0beb8dfbe05a0d4ef6df48734e825902ba312818c7157306f7ee6b513e7defec",
  "extract_tool": "extract_text.py",
  "extract_tool_version": "pypdf=6.9.2;beautifulsoup4=4.14.3;lxml=6.0.2",
  "file": "literature/koch_2009.pdf",
  "host_user": "56687218+Vasquomw21@users.noreply.github.com",
  "key": "koch_2009",
  "pmcid": "",
  "record_sha256": "41f66e48425335f559b06b72c7a318cd7131ffa15587fd43a404ba0f37722c7a",
  "retrieved": "20260614",
  "source_sha256": "0fb0bf7c6f44d99d4d8474d2197cfe92bde788fc9f5c582dad0ce48098959939",
  "transcript_sha256": "f9ff9704a21b85500130d2a68506068665cabdce11e3a0dc3b887077cb1ee574",
  "url": "https://arxiv.org/abs/0807.3349",
  "verified_date": "20260614",
  "verified_verdict": "pass",
  "verifier_version": "2"
}
