{
  "body_sha256": "9c89dacd2add25b02cc8f80f1c69d7a5d6d62c596fca6847cb27e5c2d77f1ef3",
  "command": "literature/verify_quotes.py --stamp",
  "doi": "10.22331/q-2021-04-15-433",
  "extract_sha256": "dae17f6d6a9ca303ec61ce36dc5efceaefe322cb4d116710fbf86c794ffc2901",
  "extract_tool": "extract_text.py",
  "extract_tool_version": "pypdf=6.9.2;beautifulsoup4=4.14.3;lxml=6.0.2",
  "file": "literature/gidney_2021.html",
  "host_user": "56687218+Vasquomw21@users.noreply.github.com",
  "key": "gidney_2021",
  "pmcid": "",
  "record_sha256": "dfef73ad5fc7ab514d1ad6b3ab604dab758b038322bcf52d1dc0b6e2e7750d03",
  "retrieved": "20260603",
  "source_sha256": "a6284a7b2aaf4af88973eb027f14d229691489783305fba2860c1f794535ecf0",
  "transcript_sha256": "001c5a035a0b6de7a7d84535137eb359d33ef3f036ad08e578faf375dd5bb1df",
  "url": "https://doi.org/10.22331/q-2021-04-15-433",
  "verified_date": "20260615",
  "verified_verdict": "pass",
  "verifier_version": "2"
}
