{
  "body_sha256": "62dcb6c58d1b93841c9aa8afcb44862b485ce35f557304ef24f5c6b4ac4a7edd",
  "command": "literature/verify_quotes.py --stamp",
  "doi": "10.1161/CIRCULATIONAHA.118.038813",
  "extract_sha256": "5ccc2ed493f990e3d1d1db175147a24948e0d7f6fa91bd734496eb518c006c1a",
  "extract_tool": "extract_text.py",
  "extract_tool_version": "pypdf=6.13.2;beautifulsoup4=4.15.0;lxml=6.1.1",
  "file": "literature/key_2019.html",
  "host_user": "56687218+Vasquomw21@users.noreply.github.com",
  "key": "key_2019",
  "pmcid": "PMC6629175",
  "record_sha256": "23904bf2eaa0b0a8f19af454fd780ec405b98efb1589e269ea0f0a27d5236e5b",
  "retrieved": "20260614",
  "source_sha256": "b5d37d5a21d65697306350ff162655b641e0f1d0587918b30f0c01cc4c86796f",
  "transcript_sha256": "782fff80b814baa27b65205d84234ba07d7f1237b33b3370fcd03ec9ed2b1425",
  "url": "https://pmc.ncbi.nlm.nih.gov/articles/PMC6629175/",
  "verified_date": "20260717",
  "verified_verdict": "pass",
  "verifier_version": "2"
}
