{
  "body_sha256": "a6f131bea778a18f3f1d9dc46c20adfcd5ba9a3ad06885502823efd9000d25eb",
  "command": "literature/verify_quotes.py --stamp",
  "doi": "10.1038/s41586-021-03819-2",
  "extract_sha256": "fa8492ee46782c16c17516209080ae2ebbe6f7b98ef412b9fae8d2ee95479d8d",
  "extract_tool": "extract_text.py",
  "extract_tool_version": "pypdf=6.13.2;beautifulsoup4=4.15.0;lxml=6.1.1",
  "file": "literature/jumper_2021.pdf",
  "host_user": "56687218+Vasquomw21@users.noreply.github.com",
  "key": "jumper_2021",
  "pmcid": "",
  "record_sha256": "d8241f6f3e8e7042365d92bfb3f12ad054c6cd858f57e1ea6d619da9a43c4bee",
  "retrieved": "20260603",
  "source_sha256": "6eae057a9faf4f671c3101e0745ed704460c6d3dec77243dfd3a9f2d2ab68970",
  "transcript_sha256": "2395f4bccebd048604b05586b0aafee7b95a17cfdbe10f35b54222258091029c",
  "url": "https://doi.org/10.1038/s41586-021-03819-2",
  "verified_date": "20260717",
  "verified_verdict": "pass",
  "verifier_version": "2"
}
