{
  "body_sha256": "a05c99c889fef99209a298601063ba3b76172ccfcd4ef4452ff69c13d4f04f00",
  "command": "literature/verify_quotes.py --stamp",
  "doi": "",
  "extract_sha256": "2f328367cb002436b127c811585fe84a8cde8cc51ca594d11e4f92a20d42a5d7",
  "extract_tool": "extract_text.py",
  "extract_tool_version": "pypdf=6.13.2;beautifulsoup4=4.15.0;lxml=6.1.1",
  "file": "literature/weissman.html",
  "host_user": "56687218+Vasquomw21@users.noreply.github.com",
  "key": "weissman",
  "pmcid": "",
  "record_sha256": "d0aac07afe30e3669c9c095f22e2e110a2c73651ade3d7fb4e6dee354a7b3895",
  "retrieved": "20260614",
  "source_sha256": "f012610800dc69e462f6f4f134566869e5b8623c917598a15b0531045031cfe9",
  "transcript_sha256": "0bf8d653b5246017c53ed971ced3f7791c80ea7c3f52be415f29279c4db58951",
  "url": "https://michaelweissman.substack.com/p/an-inconvenient-probability-v50",
  "verified_date": "20260717",
  "verified_verdict": "pass",
  "verifier_version": "2"
}
